{
  "$schema": "../schemas/textbook-lesson.schema.json",
  "schemaVersion": "1.0.0",
  "id": "hsk2-tb-lesson-08",
  "lessonNumber": 8,
  "status": "review",
  "title": {
    "zh": "让我想想再告诉你。",
    "pinyin": "ràng wǒ xiǎng xiǎng zài gào sù nǐ。",
    "vi": "Để mình suy nghĩ rồi sẽ nói cho bạn biết."
  },
  "source": {
    "pdfPages": [
      71,
      78
    ],
    "printedPages": [
      71,
      78
    ],
    "missingPrintedPages": [],
    "sourcePageRefs": [
      "hsk2-tb-source-page-071",
      "hsk2-tb-source-page-072",
      "hsk2-tb-source-page-073",
      "hsk2-tb-source-page-074",
      "hsk2-tb-source-page-075",
      "hsk2-tb-source-page-076",
      "hsk2-tb-source-page-077",
      "hsk2-tb-source-page-078"
    ]
  },
  "sections": [
    {
      "type": "warmup",
      "contentRefs": [
        "hsk2-tb-l08-warmup-01"
      ]
    },
    {
      "type": "texts",
      "contentRefs": [
        "hsk2-tb-lesson-08-scene-1",
        "hsk2-tb-lesson-08-scene-2",
        "hsk2-tb-lesson-08-scene-3",
        "hsk2-tb-lesson-08-scene-4"
      ],
      "sourcePageRefs": [
        "hsk2-tb-source-page-072",
        "hsk2-tb-source-page-073"
      ]
    },
    {
      "type": "vocabulary",
      "contentRefs": [
        "hsk2-tb-l08-v01",
        "hsk2-tb-l08-v02",
        "hsk2-tb-l08-v03",
        "hsk2-tb-l08-v04",
        "hsk2-tb-l08-v05",
        "hsk2-tb-l08-v06",
        "hsk2-tb-l08-v07",
        "hsk2-tb-l08-v08",
        "hsk2-tb-l08-v09",
        "hsk2-tb-l08-v10"
      ]
    },
    {
      "type": "pinyin-transcript",
      "contentRefs": []
    },
    {
      "type": "grammar",
      "contentRefs": [
        "hsk2-tb-l08-grammar-01",
        "hsk2-tb-l08-grammar-02",
        "hsk2-tb-l08-grammar-03",
        "hsk2-tb-l08-grammar-04"
      ],
      "sourceBlockRefs": [
        "hsk2-tb-l08-grammar-01"
      ]
    },
    {
      "type": "practice",
      "contentRefs": [
        "hsk2-tb-l08-practice-01"
      ]
    },
    {
      "type": "hanzi",
      "contentRefs": [
        "hsk2-tb-l08-hanzi-01"
      ]
    },
    {
      "type": "application",
      "contentRefs": [
        "hsk2-tb-l08-application-01"
      ]
    },
    {
      "type": "pronunciation",
      "contentRefs": [
        "hsk2-tb-l08-pronunciation"
      ],
      "sourceBlockRefs": [
        "hsk2-tb-l08-pronunciation-01"
      ]
    }
  ],
  "editorial": {
    "publicationReady": false,
    "answerStatus": "not-provided-in-source-pdf",
    "sourceGapStatus": "complete-page-range",
    "requiredActions": [
      "Đối chiếu OCR tiếng Trung, tiếng Việt và tên riêng với PDF.",
      "Bổ sung audio theo mã track.",
      "Rà soát quyền sử dụng hình minh họa."
    ]
  }
}
